[
  {
    "id": "f-va-definition-loi",
    "chapter": "variables-aleatoires",
    "domain": "probabilites",
    "title": "Variable aléatoire et loi de probabilité",
    "statement": "Soit $\\Omega$ un univers fini. Une **variable aléatoire réelle** $X$ est une fonction qui à chaque issue $\\omega \\in \\Omega$ associe un nombre réel $X(\\omega)$.\n\nSi $X$ prend les valeurs $x_1, x_2, \\ldots, x_k$, la **loi de probabilité** de $X$ est le tableau :\n\n| $X$ | $x_1$ | $x_2$ | $\\cdots$ | $x_k$ |\n|---|---|---|---|---|\n| $P(X = x_i)$ | $p_1$ | $p_2$ | $\\cdots$ | $p_k$ |\n\navec $p_i = P(X = x_i) \\geq 0$ pour tout $i$, et $p_1 + p_2 + \\cdots + p_k = 1$.",
    "conditions": "L'univers $\\Omega$ doit être **fini** (on ne traite pas les variables aléatoires à valeurs dans $\\mathbb{N}$ ou $\\mathbb{R}$ entier). La somme des probabilités vaut impérativement $1$.",
    "example": "On lance un dé équilibré. Soit $X$ le résultat. $X$ prend les valeurs $1, 2, 3, 4, 5, 6$, chacune avec probabilité $\\dfrac{1}{6}$. La somme des probabilités vaut $6 \\times \\dfrac{1}{6} = 1$.",
    "tags": ["variable-aleatoire", "loi", "tableau", "definition"],
    "order": 10,
    "level": "essentiel",
    "simplified": {
      "core": "$X$ prend les valeurs $x_1, \\ldots, x_k$ avec $P(X = x_i) = p_i \\geq 0$ et $\\sum p_i = 1$.",
      "mnemonic": "La somme de toutes les probabilités vaut toujours 1.",
      "keyword": "loi-probabilité",
      "visual": "Tableau à deux lignes : valeurs de $X$ sur la première, probabilités correspondantes sur la deuxième — la somme de la ligne du bas vaut 1.",
      "accent": "blue"
    }
  },
  {
    "id": "f-va-esperance-def",
    "chapter": "variables-aleatoires",
    "domain": "probabilites",
    "title": "Espérance d'une variable aléatoire",
    "statement": "Soit $X$ une variable aléatoire prenant les valeurs $x_1, x_2, \\ldots, x_k$ avec les probabilités $p_1, p_2, \\ldots, p_k$. L'**espérance** de $X$ est définie par :\n\n$$E(X) = \\sum_{i=1}^{k} x_i \\cdot p_i = x_1 p_1 + x_2 p_2 + \\cdots + x_k p_k$$\n\nL'espérance est la **valeur moyenne** que l'on observe sur un grand nombre de réalisations de $X$.",
    "conditions": "La formule s'applique à toute variable aléatoire sur un univers fini.",
    "example": "Si $X$ prend les valeurs $0$, $2$, $4$ avec les probabilités $\\dfrac{1}{2}$, $\\dfrac{1}{4}$, $\\dfrac{1}{4}$, alors :\n$$E(X) = 0 \\times \\dfrac{1}{2} + 2 \\times \\dfrac{1}{4} + 4 \\times \\dfrac{1}{4} = 0 + \\dfrac{1}{2} + 1 = \\dfrac{3}{2}.$$",
    "tags": ["esperance", "definition", "moyenne"],
    "order": 20,
    "level": "essentiel",
    "simplified": {
      "core": "$$E(X) = \\sum_{i} x_i \\cdot P(X = x_i)$$",
      "mnemonic": "Chaque valeur multipliée par sa probabilité, on additionne tout.",
      "keyword": "espérance",
      "visual": "Barycentre des valeurs, pondéré par les probabilités : si une valeur est très probable, elle « attire » davantage la moyenne.",
      "accent": "red"
    }
  },
  {
    "id": "f-va-variance-def",
    "chapter": "variables-aleatoires",
    "domain": "probabilites",
    "title": "Variance d'une variable aléatoire",
    "statement": "La **variance** de $X$ mesure la dispersion des valeurs autour de l'espérance. Elle est définie par :\n\n$$V(X) = E\\!\\left((X - E(X))^2\\right) = \\sum_{i=1}^{k} (x_i - E(X))^2 \\cdot p_i$$\n\nOn dispose également de la **formule de Koenig-Huygens**, plus pratique pour le calcul :\n\n$$V(X) = E(X^2) - \\left(E(X)\\right)^2$$\n\noù $E(X^2) = \\displaystyle\\sum_{i=1}^{k} x_i^2 \\cdot p_i$.",
    "conditions": "$V(X) \\geq 0$ toujours. $V(X) = 0$ si et seulement si $X$ est constante (prend une seule valeur).",
    "example": "Avec $E(X) = \\dfrac{3}{2}$, $E(X^2) = 0^2 \\times \\dfrac{1}{2} + 2^2 \\times \\dfrac{1}{4} + 4^2 \\times \\dfrac{1}{4} = 0 + 1 + 4 = 5$. Donc $V(X) = 5 - \\left(\\dfrac{3}{2}\\right)^2 = 5 - \\dfrac{9}{4} = \\dfrac{11}{4}$.",
    "tags": ["variance", "definition", "koenig-huygens", "dispersion"],
    "order": 30,
    "level": "essentiel",
    "relatedFormulas": ["f-va-esperance-def", "f-va-ecart-type"],
    "simplified": {
      "core": "$$V(X) = E(X^2) - \\bigl(E(X)\\bigr)^2$$",
      "mnemonic": "Carré de la moyenne des carrés, moins carré de la moyenne.",
      "keyword": "variance",
      "visual": "Plus $V(X)$ est grand, plus les valeurs sont éparpillées autour de l'espérance. $V(X) = 0$ si $X$ ne prend qu'une valeur.",
      "accent": "red"
    }
  },
  {
    "id": "f-va-ecart-type",
    "chapter": "variables-aleatoires",
    "domain": "probabilites",
    "title": "Écart-type d'une variable aléatoire",
    "statement": "L'**écart-type** de $X$ est la racine carrée de la variance :\n\n$$\\sigma(X) = \\sqrt{V(X)}$$\n\nIl est exprimé dans la **même unité** que $X$, ce qui le rend plus facilement interprétable que la variance. Un grand écart-type signifie que les valeurs sont très dispersées autour de l'espérance.",
    "conditions": "$\\sigma(X) \\geq 0$. L'écart-type est nul si et seulement si $X$ est constante.",
    "example": "Si $V(X) = \\dfrac{11}{4}$, alors $\\sigma(X) = \\sqrt{\\dfrac{11}{4}} = \\dfrac{\\sqrt{11}}{2}$.",
    "tags": ["ecart-type", "variance", "dispersion"],
    "order": 40,
    "level": "essentiel",
    "relatedFormulas": ["f-va-variance-def"],
    "simplified": {
      "core": "$$\\sigma(X) = \\sqrt{V(X)}$$",
      "mnemonic": "Racine carrée de la variance.",
      "keyword": "écart-type",
      "visual": "Même unité que $X$, donc comparable directement aux valeurs prises. $\\sigma(X)$ petit = valeurs resserrées autour de $E(X)$.",
      "accent": "red"
    }
  },
  {
    "id": "f-va-linearite-esperance",
    "chapter": "variables-aleatoires",
    "domain": "probabilites",
    "title": "Linéarité de l'espérance",
    "statement": "Pour toute variable aléatoire $X$ et tous réels $a$ et $b$ :\n\n$$E(aX + b) = a \\cdot E(X) + b$$\n\nEn particulier :\n- $E(X + b) = E(X) + b$ (translation)\n- $E(aX) = a \\cdot E(X)$ (homothétie)\n- $E(b) = b$ pour une constante $b$",
    "example": "Si $E(X) = 3$ et $Y = 2X - 1$, alors $E(Y) = 2 \\times 3 - 1 = 5$.",
    "tags": ["esperance", "linearite", "transformation-affine"],
    "order": 50,
    "level": "essentiel",
    "relatedFormulas": ["f-va-esperance-def"],
    "simplified": {
      "core": "$$E(aX + b) = a \\cdot E(X) + b$$",
      "mnemonic": "L'espérance passe à travers une transformation affine : on applique la même transformation à $E(X)$.",
      "keyword": "linéarité-E",
      "visual": "Translater ou dilater $X$ translate ou dilate la valeur moyenne de la même façon.",
      "accent": "emerald"
    }
  },
  {
    "id": "f-va-variance-affine",
    "chapter": "variables-aleatoires",
    "domain": "probabilites",
    "title": "Variance d'une transformation affine",
    "statement": "Pour toute variable aléatoire $X$ et tous réels $a$ et $b$ :\n\n$$V(aX + b) = a^2 \\cdot V(X)$$\n\nEn particulier :\n- La **translation** ($a = 1$) ne change pas la variance : $V(X + b) = V(X)$.\n- L'**homothétie** multiplie la variance par $a^2$ : $V(aX) = a^2 V(X)$.\n- La variance d'une constante est nulle.",
    "example": "Si $V(X) = 4$ et $Y = 3X + 5$, alors $V(Y) = 3^2 \\times 4 = 9 \\times 4 = 36$. Et $\\sigma(Y) = \\sqrt{36} = 6 = 3 \\times \\sigma(X) = 3 \\times 2 = 6$.",
    "tags": ["variance", "transformation-affine", "translation", "homothetie"],
    "order": 60,
    "level": "essentiel",
    "relatedFormulas": ["f-va-variance-def", "f-va-linearite-esperance"],
    "simplified": {
      "core": "$$V(aX + b) = a^2 \\cdot V(X)$$\n\nLa translation ($b$) n'intervient **pas** dans la variance.",
      "mnemonic": "La variance ne voit pas la translation : seul le facteur $a$ compte, au carré.",
      "keyword": "variance-affine",
      "visual": "Déplacer toutes les valeurs de $b$ ne change pas l'écart entre elles. Les multiplier par $a$ les écarte $|a|$ fois plus.",
      "accent": "emerald"
    }
  },
  {
    "id": "f-va-ecart-type-affine",
    "chapter": "variables-aleatoires",
    "domain": "probabilites",
    "title": "Écart-type d'une transformation affine",
    "statement": "En prenant la racine carrée de $V(aX + b) = a^2 V(X)$, on obtient :\n\n$$\\sigma(aX + b) = |a| \\cdot \\sigma(X)$$\n\nEn particulier, $\\sigma(X + b) = \\sigma(X)$ : une translation ne modifie pas l'écart-type.",
    "conditions": "On prend la valeur absolue de $a$ car l'écart-type est toujours positif.",
    "example": "Si $\\sigma(X) = 2$ et $Y = -3X + 1$, alors $\\sigma(Y) = |-3| \\times 2 = 3 \\times 2 = 6$.",
    "tags": ["ecart-type", "transformation-affine"],
    "order": 70,
    "level": "a-connaitre",
    "relatedFormulas": ["f-va-variance-affine", "f-va-ecart-type"],
    "simplified": {
      "core": "$$\\sigma(aX + b) = |a| \\cdot \\sigma(X)$$",
      "mnemonic": "L'écart-type se multiplie par |a|, la translation ne change rien.",
      "keyword": "sigma-affine",
      "accent": "emerald"
    }
  },
  {
    "id": "f-va-echantillon-def",
    "chapter": "variables-aleatoires",
    "domain": "probabilites",
    "title": "Échantillon — somme $S_n$",
    "statement": "On répète $n$ fois la même épreuve, de façon **indépendante**. Si $X_i$ désigne le résultat de la $i$-ème épreuve (même loi que $X$), on définit la **somme** :\n\n$$S_n = X_1 + X_2 + \\cdots + X_n$$\n\nL'espérance et la variance de $S_n$ sont :\n\n$$E(S_n) = n \\cdot E(X) \\qquad V(S_n) = n \\cdot V(X)$$",
    "conditions": "Les $X_i$ doivent être **indépendantes** et de **même loi**.",
    "example": "On lance $100$ fois un dé. Chaque lancer $X_i$ a $E(X_i) = 3{,}5$. Si $S_{100}$ est la somme des résultats, $E(S_{100}) = 100 \\times 3{,}5 = 350$.",
    "tags": ["echantillon", "somme", "independance"],
    "order": 80,
    "level": "essentiel",
    "relatedFormulas": ["f-va-esperance-def", "f-va-variance-def"],
    "simplified": {
      "core": "$$E(S_n) = n \\cdot E(X) \\qquad V(S_n) = n \\cdot V(X)$$",